<?xml version="1.0" encoding="UTF-8"?>
<!DOCTYPE document PUBLIC "-//NIST LaTeXML//LaTeXML article" "LaTeXML.dtd">
<?latexml class='article'?>
<document xmlns='http://dlmf.nist.gov/LaTeXML'>
  <section>
    <p>Expect Original : Original</p>
    <p>Expect a + Original: <XMath mode='inline' tex='a+\mbox{Original}'>
        <XMTok font='italic'>a</XMTok>
        <XMTok>+</XMTok>
        <text>Original</text>
      </XMath> </p>
    <p>Expect Original : Original</p>
    <p>Expect InBox + Original:  <text>InBox</text> + Original</p>
    <p>Expect Original : Original</p>
    <p>Expect a + InlineMath: <XMath mode='inline' tex='a+\hbox{InlineMath}'>
        <XMTok font='italic'>a</XMTok>
        <XMTok>+</XMTok>
        <text>InlineMath</text>
      </XMath> </p>
    <p>Expect Original : Original</p>
    <p>Expect a + DisplayMath : </p>
    <equation>
      <XMath mode='display' tex='a+\hbox{DisplayMath}'>
        <XMTok font='italic'>a</XMTok>
        <XMTok>+</XMTok>
        <text>DisplayMath</text>
      </XMath>
    </equation>
    <p>Expect Original : Original</p>
    <p>Expect a + InText + InlineMath: <XMath mode='inline' tex='a+\hbox{InText}+\hbox{InlineMath}'>
        <XMTok font='italic'>a</XMTok>
        <XMTok>+</XMTok>
        <text>InText</text>
        <XMTok>+</XMTok>
        <text>InlineMath</text>
      </XMath> </p>
    <p>Expect Original : Original</p>
  </section>
</document>
