<?xml version="1.0" encoding="UTF-8"?>
<!DOCTYPE document PUBLIC "-//NIST LaTeXML//LaTeXML article" "LaTeXML.dtd">
<?latexml class='article'?>
<document xmlns='http://dlmf.nist.gov/LaTeXML'>
  <section refnum='1'>
    <title>Testing Over</title>
    <p><Math mode='inline' tex='abc \over def'>
        <XMath>
          <XMApp>
            <XMTok name='/' style='over'/>
            <XMArg>
              <XMTok font='italic'>a</XMTok>
              <XMTok font='italic'>b</XMTok>
              <XMTok font='italic'>c</XMTok>
            </XMArg>
            <XMArg>
              <XMTok font='italic'>d</XMTok>
              <XMTok font='italic'>e</XMTok>
              <XMTok font='italic'>f</XMTok>
            </XMArg>
          </XMApp>
        </XMath>
      </Math>
</p>
    <p><Math mode='inline' tex='a{bc \over de}f'>
        <XMath>
          <XMTok font='italic'>a</XMTok>
          <XMApp>
            <XMTok name='/' style='over'/>
            <XMArg>
              <XMTok font='italic'>b</XMTok>
              <XMTok font='italic'>c</XMTok>
            </XMArg>
            <XMArg>
              <XMTok font='italic'>d</XMTok>
              <XMTok font='italic'>e</XMTok>
            </XMArg>
          </XMApp>
          <XMTok font='italic'>f</XMTok>
        </XMath>
      </Math>
</p>
    <p><Math mode='inline' tex='a{bc \over de}f'>
        <XMath>
          <XMTok font='italic'>a</XMTok>
          <XMApp>
            <XMTok name='/' style='over'/>
            <XMArg>
              <XMTok font='italic'>b</XMTok>
              <XMTok font='italic'>c</XMTok>
            </XMArg>
            <XMArg>
              <XMTok font='italic'>d</XMTok>
              <XMTok font='italic'>e</XMTok>
            </XMArg>
          </XMApp>
          <XMTok font='italic'>f</XMTok>
        </XMath>
      </Math>
</p>
    <p><Math mode='inline' tex='a{bc \over de}f'>
        <XMath>
          <XMTok font='italic'>a</XMTok>
          <XMApp>
            <XMTok name='/' style='over'/>
            <XMArg>
              <XMTok font='italic'>b</XMTok>
              <XMTok font='italic'>c</XMTok>
            </XMArg>
            <XMArg>
              <XMTok font='italic'>d</XMTok>
              <XMTok font='italic'>e</XMTok>
            </XMArg>
          </XMApp>
          <XMTok font='italic'>f</XMTok>
        </XMath>
      </Math>
</p>
    <p><Math mode='inline' tex='a{bc \over de}f'>
        <XMath>
          <XMTok font='italic'>a</XMTok>
          <XMApp>
            <XMTok name='/' style='over'/>
            <XMArg>
              <XMTok font='italic'>b</XMTok>
              <XMTok font='italic'>c</XMTok>
            </XMArg>
            <XMArg>
              <XMTok font='italic'>d</XMTok>
              <XMTok font='italic'>e</XMTok>
            </XMArg>
          </XMApp>
          <XMTok font='italic'>f</XMTok>
        </XMath>
      </Math>
</p>
    <p><Math mode='inline' tex='a{bc \over d \over e}f'>
        <XMath>
          <XMTok font='italic'>a</XMTok>
          <XMApp>
            <XMTok name='/' style='over'/>
            <XMArg>
              <XMTok font='italic'>b</XMTok>
              <XMTok font='italic'>c</XMTok>
            </XMArg>
            <XMArg>
              <XMApp>
                <XMTok name='/' style='over'/>
                <XMArg>
                  <XMTok font='italic'>d</XMTok>
                </XMArg>
                <XMArg>
                  <XMTok font='italic'>e</XMTok>
                </XMArg>
              </XMApp>
            </XMArg>
          </XMApp>
          <XMTok font='italic'>f</XMTok>
        </XMath>
      </Math>
<Math mode='inline' tex='\{a\}'>
        <XMath>
          <XMTok>{</XMTok>
          <XMTok font='italic'>a</XMTok>
          <XMTok>}</XMTok>
        </XMath>
      </Math>
<Math mode='inline' tex='\left\{a\right\}'>
        <XMath>
          <XMTok POS='OPEN'>{</XMTok>
          <XMTok font='italic'>a</XMTok>
          <XMTok POS='CLOSE'>}</XMTok>
        </XMath>
      </Math>
</p>
  </section>
</document>
