<?xml version="1.0" encoding="UTF-8"?>
<!DOCTYPE document PUBLIC "-//NIST LaTeXML//LaTeXML article" "LaTeXML.dtd">
<?latexml class='article'?>
<?latexml package='comment'?>
<document xmlns='http://dlmf.nist.gov/LaTeXML'>
  <section>
    <p>Before Comment.
After Comment.
</p>
    <p>Before Included.
Inside Included.
After Included.
</p>
    <p>Before Excluded.
After Excluded.
</p>
    <p>Before BoldSpecial.
[<textstyle font='bold'>Inside BoldSpecial.
</textstyle>]After BoldSpecial.
</p>
    <p>Before Included.
<textstyle font='bold'>Bold Inside Included.
After Included, but still Bold.
</textstyle></p>
  </section>
</document>
