<?xml version="1.0" encoding="UTF-8"?>
<!DOCTYPE document PUBLIC "-//NIST LaTeXML//LaTeXML article" "LaTeXML.dtd">
<?latexml class='article'?>
<document>
  <section refnum='1'>
    <title>Testing</title>
    <p>Testing raw tex macros: Expect inline math: xx<XMath mode='inline' tex='a+b'>
        <XMTok font='italic'>a</XMTok>
        <XMTok>+</XMTok>
        <XMTok font='italic'>b</XMTok>
      </XMath>xx </p>
    <p>Expect display math: xx</p>
    <equation>
      <XMath mode='display' tex='a+b'>
        <XMTok font='italic'>a</XMTok>
        <XMTok>+</XMTok>
        <XMTok font='italic'>b</XMTok>
      </XMath>
    </equation>
    <p>xx </p>
    <p>Expect 2 empty maths: xxa+bxx </p>
    <p>Testing latex macros Expect (onearg: one) (onearg: one) Expect (twoarg: one two) (twoarg: one ; two) Expect (twoargopt: one ; two) (twoargopt: one ; two) Expect (twoargopt: missing ; two)(twoargopt: missing ; two) </p>
    <p>Testing whitespace: Expect (twoarg: a ; b) (twoarg: a ; b) Expect (textwoarg: a ; b) (textwoarg: a ; b) Expect (twoargopt: a ; b) (twoargopt: a ; b) </p>
    <p>Expecting (beep) : (beep) </p>
    <p>Expecting (foo) : (foo)</p>
    <p>Expect [[x]] : [[x]]Expect (y(x)y) : (y(x)y) Expect [[x]] : [[x]]</p>
    <p>Expect NOW a LATER b MUCHLATER c: NOW a LATER b MUCHLATER c</p>
  </section>
</document>
