<?xml version="1.0" encoding="UTF-8"?>
<!DOCTYPE document PUBLIC "-//NIST LaTeXML//LaTeXML article" "LaTeXML.dtd">
<?latexml class='article'?>
<document xmlns='http://dlmf.nist.gov/LaTeXML'>
  <section refnum='1'>
    <title>Testing Verbatim</title>
    <p>Normal <textstyle font='bold'>Bold</textstyle> stuff.
</p>
    <verbatim font='typewriter'>
AbNormal {\bf NonBold} stuff.
</verbatim>
    <p>More Normal <textstyle font='bold'>Bold</textstyle> stuff.
</p>
  </section>
</document>
